mysql> create database Address_book_service;
Query OK, 1 row affected (0.05 sec)

mysql> show databases;
+----------------------+
| Database             |
+----------------------+
| Address_book_service |
| information_schema   |
| mysql                |
| naincy_schema        |
| payroll_service      |
| performance_schema   |
| pet_store            |
| sys                  |
+----------------------+
8 rows in set (0.03 sec)

mysql> use Address_book_service;
Database changed
mysql> create table addressBook(
    -> firstName varchar(20) not null,
    -> lastName varchar(20) not null,
    -> address varchar(100) not null,
    -> city varchar(25) not null,
    -> state varchar(20) not null,
    -> zip varchar(20) not null,
    -> phoneNumber varchar(20) not null,
    -> email varchar(100) not null,
    -> primary key(phoneNumber));
Query OK, 0 rows affected (0.01 sec)

mysql> insert into addressBook(firstName,lastName,address,city,state,zip,phoneNumber,email) 
    -> values('aman','raj','india', 'patna','bihar','821305','9955886677','amanraj@gmail.com'),
    -> ('atul','raj','india', 'bhopal','madhyaPradesh','821308','9955667788','atulraj@gmail.com'),
    -> ('shristy','singh','india', 'bangalore','karnataka','821897','9955882211','shristy@gmail.com');
Query OK, 3 rows affected (0.02 sec)
Records: 3  Duplicates: 0  Warnings: 0

mysql> select * from addressBook;
+-----------+----------+---------+-----------+---------------+--------+-------------+-------------------+
| firstName | lastName | address | city      | state         | zip    | phoneNumber | email             |
+-----------+----------+---------+-----------+---------------+--------+-------------+-------------------+
| atul      | raj      | india   | bhopal    | madhyaPradesh | 821308 | 9955667788  | atulraj@gmail.com |
| shristy   | singh    | india   | bangalore | karnataka     | 821897 | 9955882211  | shristy@gmail.com |
| aman      | raj      | india   | patna     | bihar         | 821305 | 9955886677  | amanraj@gmail.com |
+-----------+----------+---------+-----------+---------------+--------+-------------+-------------------+
3 rows in set (0.01 sec)
mysql> update addressBook set address = 'germany' where firstName = 'aman';
Query OK, 1 row affected (0.01 sec)
Rows matched: 1  Changed: 1  Warnings: 0

mysql> select * from addressBook;
+-----------+----------+---------+-----------+---------------+--------+-------------+-------------------+
| firstName | lastName | address | city      | state         | zip    | phoneNumber | email             |
+-----------+----------+---------+-----------+---------------+--------+-------------+-------------------+
| atul      | raj      | india   | bhopal    | madhyaPradesh | 821308 | 9955667788  | atulraj@gmail.com |
| shristy   | singh    | india   | bangalore | karnataka     | 821897 | 9955882211  | shristy@gmail.com |
| aman      | raj      | germany | patna     | bihar         | 821305 | 9955886677  | amanraj@gmail.com |
+-----------+----------+---------+-----------+---------------+--------+-------------+-------------------+
3 rows in set (0.00 sec)
mysql> delete from addressBook where firstName = 'shristy';
Query OK, 1 row affected (0.01 sec)

mysql> select * from addressBook;
+-----------+----------+---------+--------+---------------+--------+-------------+-------------------+
| firstName | lastName | address | city   | state         | zip    | phoneNumber | email             |
+-----------+----------+---------+--------+---------------+--------+-------------+-------------------+
| atul      | raj      | india   | bhopal | madhyaPradesh | 821308 | 9955667788  | atulraj@gmail.com |
| aman      | raj      | germany | patna  | bihar         | 821305 | 9955886677  | amanraj@gmail.com |
+-----------+----------+---------+--------+---------------+--------+-------------+-------------------+
2 rows in set (0.00 sec)

mysql> select * from addressBook where city = 'bhopal' or state = 'madhyaPradesh';
+-----------+----------+---------+--------+---------------+--------+-------------+-------------------+
| firstName | lastName | address | city   | state         | zip    | phoneNumber | email             |
+-----------+----------+---------+--------+---------------+--------+-------------+-------------------+
| atul      | raj      | india   | bhopal | madhyaPradesh | 821308 | 9955667788  | atulraj@gmail.com |
+-----------+----------+---------+--------+---------------+--------+-------------+-------------------+
1 row in set (0.00 sec)
mysql> select city, state ,count(*) from addressbook group by city;
+-----------+------------+----------+
| city      | state      | count(*) |
+-----------+------------+----------+
| bhopal.   |madhyapradesh|       1 |
| patna     | bihar      |        1 |
+-----------+------------+----------+
